{
  "$schema": "http://json-schema.org/draft-07/schema#",
  "$id": "https://json.schemastore.org/extension.json",
  "title": "Nova Extension Manifest",
  "description": "A schema for defining Nova extension manifests.",
  "type": "object",
  "additionalProperties": false,
  "required": [
    "bugs",
    "categories",
    "description",
    "identifier",
    "name",
    "organization",
    "version"
  ],
  "properties": {
    "activationEvents": {
      "type": "array",
      "items": {
        "type": "string"
      },
      "description": "Set of Activation Events."
    },
    "breakpoints": {
      "type": "array",
      "items": {
        "type": "string"
      },
      "description": "Set of Breakpoint templates provided (Nova 9)."
    },
    "bugs": {
      "type": "string",
      "format": "uri",
      "description": "URL to the extension’s issue reporter link (required)."
    },
    "categories": {
      "type": "array",
      "items": {
        "type": "string"
      },
      "description": "An array of Category identifiers (required)."
    },
    "commands": {
      "type": "array",
      "items": {
        "type": "object",
        "properties": {
          "identifier": {
            "type": "string",
            "description": "The unique identifier for the command."
          },
          "name": {
            "type": "string",
            "description": "The user-readable name of the command."
          }
        },
        "required": ["identifier", "name"],
        "additionalProperties": false
      },
      "description": "Set of Commands provided."
    },
    "config": {
      "type": "object",
      "description": "Set of global Preferences."
    },
    "configWorkspace": {
      "type": "object",
      "description": "Set of workspace (project-specific) Preferences."
    },
    "description": {
      "type": "string",
      "description": "The user-readable descriptive text (required)."
    },
    "debugAdapters": {
      "type": "array",
      "items": {
        "type": "object",
        "properties": {
          "identifier": {
            "type": "string",
            "description": "The unique identifier for the debug adapter."
          },
          "name": {
            "type": "string",
            "description": "The user-readable name of the debug adapter."
          }
        },
        "required": ["identifier", "name"],
        "additionalProperties": false
      },
      "description": "Set of Debug Adapters provided (Nova 9)."
    },
    "entitlements": {
      "type": "object",
      "description": "Description of an extension’s Entitlements."
    },
    "funding": {
      "type": "string",
      "format": "uri",
      "description": "URL to the extension’s funding link, if any (Nova 2)."
    },
    "homepage": {
      "type": "string",
      "format": "uri",
      "description": "URL to the extension’s homepage link, if any."
    },
    "identifier": {
      "type": "string",
      "description": "The unique extension identifier (required)."
    },
    "issueMatchers": {
      "type": "array",
      "items": {
        "type": "object",
        "properties": {
          "pattern": {
            "type": "string",
            "description": "Regex pattern for matching issues."
          },
          "severity": {
            "type": "string",
            "enum": ["error", "warning", "info"],
            "description": "The severity level of the issue."
          }
        },
        "required": ["pattern"],
        "additionalProperties": false
      },
      "description": "Set of Issue Matchers provided to the IssueParser API."
    },
    "license": {
      "type": "string",
      "description": "The name of the extension’s license, if any."
    },
    "max_runtime": {
      "type": "string",
      "description": "The maximum runtime supported."
    },
    "min_runtime": {
      "type": "string",
      "description": "The minimum runtime supported."
    },
    "name": {
      "type": "string",
      "description": "The user-readable name (required)."
    },
    "organization": {
      "type": "string",
      "description": "The user-readable organization name (required)."
    },
    "repository": {
      "type": "string",
      "format": "uri",
      "description": "URL to the extension’s repository link, if any."
    },
    "version": {
      "type": "string",
      "pattern": "^\\d+\\.\\d+\\.\\d+$",
      "description": "The extension version (required). Must follow semantic versioning."
    },
    "main": {
      "type": "string",
      "description": "Relative path to the extension’s Main Script."
    },
    "sidebars": {
      "type": "array",
      "items": {
        "type": "object",
        "properties": {
          "identifier": {
            "type": "string",
            "description": "The unique identifier for the sidebar."
          },
          "name": {
            "type": "string",
            "description": "The user-readable name of the sidebar."
          }
        },
        "required": ["identifier", "name"],
        "additionalProperties": false
      },
      "description": "Set of Sidebars provided to the TreeView API."
    },
    "taskTemplates": {
      "type": "array",
      "items": {
        "type": "string"
      },
      "description": "Set of Task Templates."
    }
  }
}
