{
  "bugs": "https://example.com/debug-issues",
  "categories": ["Debugging"],
  "debugAdapters": [
    {
      "identifier": "debug.helper.adapter",
      "name": "Debug Helper Adapter"
    }
  ],
  "description": "An extension with debug support.",
  "identifier": "com.example.debug-helper",
  "name": "Debug Helper",
  "organization": "Debug Tools Ltd.",
  "version": "1.1.0"
}
